comment_body,date
"ADA is not ""decentralised like ETH"".

It uses DPOS, which isn't really truly decentralised, and it has only around 1000 total validators. This number is unlikely to grow significantly due to the high barrier to entry, and that most people will need to delegate their stakes to these **centralised** staking pools.

ETH 2.0 has over 100,000 individual validators already, and growing everyday. It allows users to run their own validator, rather than having to delegate their stake to a third party pool operator.

Not to mention, that many of the ADA validators are actually still centralised. There is a plan to switch off all the centralised ADA nodes later this year. However the developers are able to switch them back on at anytime, and can in theory take 100% control of the blockchain whenever they want. Again, there is a future plan to hard fork and remove this control, but it is unclear when that will actually happen.

Cardano, in it's current form, is extremely centralised, just like BSC. While they do have a roadmap, it is less ambitious, and less progressed than the ETH 2.0 roadmap.

Here is a run down:

**ETH 1.0**

* Fully decentralised, proof of **work** (POW) blockchain
* Working smart contract platform, with proven 100% uptime

**ETH 2.0**

* Fully decentralised, proof of **stake** (POS) blockchain, without the need for centralised staking pools
* Smart contract platform still in development

**Cardano**

* Partially centralised, partially **delegated** proof of **stake** (DPOS) blockchain. However a move to a fully DPOS blockchain is in progress. DPOS, once fully achieved later this year, still requires centralised staking pools.
* Smart contract platform still in development",2021-02-28
"\>(and soon ADA)

I wouldn't expect a 4 years old smart contract platform that still has no smart contract to deliver anything on the date they claim they will.

Also BSC is literally not a crypto. It's just a regular centralized website you can run solidity code on.",2021-02-28
"If you don't want to use/buy ETH, don't.  There is a battle raging right now - from my (admittedly limited) understanding - that will potentially reduce gas prices.  It will also burn a small amount of ETH per transaction while keeping the same market cap - a rising tide lifting all ships.  It is bonkers to me that miners are as opposed as they are.  It has shades of coal energy vs renewables.    


Yes, you're making tons of money right now - but you're sacrificing the long term viability of your network to do so.    


But hey, you wanna drive the price down?  Fine - I still believe in the network in the long run, with EIP 1559 and ETH 2.0 in full force years down the road.  I'll keep on buying dips where I can and HODL.",2021-02-28
Also - The Cardano has moved $14.7B for $7.4 grands in transaction fee whereas ETH moved $13.48B for $26.35M in last 24 hours.,2021-02-27
"Personally for me it’s about fundamentals. Fiat currency is fundamentally corrupt at some point along the way. (IE the 3 trillion dollar print out by US fed). 

At least crypto has a fair chance of not being corrupted.",2021-02-24
How sick are you of hearing the same thing from these naysayers over and over? What's a way we can keep pushing real crypto information to counteract these people?,2021-02-24
I'll lose interest in selling.... So thats kind of the same right?,2021-02-25
"Crypto is two sided ways, it's either a bull run or a bearish season. If you are old enough in this space you definitely should understand how it works. 

I'm not selling any tokens in my portfolio, but instead it's a chance to accummulate more, personally, I'd be getting more MATIC, JULD, XED, DOT and SCIFI. 

It's a normal to have dips, it depends on what you do with it.",2021-02-25
Very true! So many people sell the minute the price fluctuates.  It doesn't work like that. I've had ORO for a very long time and I hold it regardless of whether it dips or not because I know the long term is looking good! I've been holding tight for the remarkable unifarm APY. The same with XLM and DOT,2021-02-25
"This posts is as narrow minded as the argument it’s countering. It negates the hundreds/thousands of individuals/channels out there that not only support the mining community, but also teach and educate it. 

If anyone’s basing their faith and confidence in the market on the bandwagoning mentality around then, then they have no business investing at that point until they take it upon themselves to educate themselves. 

Not trying to be a dick here, but this is literally life 101.",2021-02-24
"Personally for me crypto its also corrupt or would it be. Because the problem its not the government, it is the humanity and the greed. The crypto doesnt eliminate greed, even feed it, a lot, with steroid, a cocain, and chocolate. Huge, addicted and fat...",2021-04-18
Why would you say fiat is fundamentally corrupt?,2021-02-24
"No need friend. I find the rising price does all the talking. A few % of people come around every time new ATH is broken.

It's funny to realize how so many of our human peers live with their heads up their asses. They are content serving us coffee.",2021-02-24
"Not the least bit. Why would we need to “counteract” anyone? The last thing we need now is even more people on the hype train.

You do you and them do them. Don’t push information onto those who haven’t asked for it.

If anything , I’m more annoyed with the Messiahs who can’t stop trying to convince other ppl about what they should “invest” in.",2021-02-24
"I never advised anyone to blindly buy I told people to do their own due diligence in my post. I'm telling them to be mindful of bearish people that are extremely fairweather when it comes to crypto, have no real knowledge in this space and frankly have no idea what they're talking about. 

My post was clearly anti bandwagon and pro due diligence but also pro crypto. ""Taking it upon themselves to educate themselves"" is clearly something I promoted in my post. I understand the point you're trying to make but the truth is nothing good really comes from listening to people that don't know what they're talking about and those are the kind of people I was referring to in my post.",2021-02-24
Nice man nice!,2021-04-18
Because it can be printed and manipulated by a select few imo,2021-02-25
It’s “government” made money and government is corrupt. Look around.,2021-02-24
Disinformation should definitely be counteracted. It's not good to allow lies to spread about. And I don't plan on preaching about crypto to people that aren't interested in it.,2021-02-24
It’s the same as an overly religious person pushing religion on innocent bystanders. Or those darn vegans.,2021-02-24
"Fair enough. Props to you for pushing optimism in a space where others capitalize on the lack of it. 

I do get what you’re saying, but to me this just screams “participation trophy”.  Just seems like common sense.",2021-02-24
Crypto too :D,2021-02-28
[deleted],2021-02-25
"> What's a way we can keep pushing real crypto information to counteract these people?

> And I don't plan on preaching about crypto to people that aren't interested in it.

Could you clarify what you actually mean, then, because those statements seem contradictory?",2021-02-24
"Thanks and all I'm trying to do is make the truth easier to see, I'm not trying to push info on anyone that doesn't want it. And it may seem like common sense but if that were the case we wouldn't have the same people hopping on tv and repeating the same thing each and every cycle. It seems common sense is very lacking when moneys involved.",2021-02-24
"Anyone can create a crypto coin, but certain coins will only ever have x amount in circulation. Once that amount is hit, no new ones can be made",2021-02-28
"Correct, I misspoke. I’d also like to correct “corruption” and replace it with manipulation",2021-02-25
Yeah Right ... I agree BUT crypto dipping these last days is a result of big whales like f2pool dumping large amount of (let’s say) 4k btc within an hour on exchanges to buy lower thru the panick sell people are going into,2021-02-28
"Even then, it's better than fiat money because you only have centralisation to worry about, not printing money for free.

And if you don't like it there's Cardano, which is very decentralised (I remember only 26% of the people own substantial amounts, compared to 80% in Bitcoin). I don't have the source link since I don't remember on what post I read it.",2021-03-04
"1. I moderate /r/ethdev, and formerly moderated a few subs for an old employer. (I used to moderate /r/etherdelta before I had a conflict of interest with my job, and before that whole project was sold and fell apart.)

2. USA/Eastern

3. I've been involved since 2015, and my focus has been Dexs since that time.

4. My moderation focus is usually anti-spam and answering technical (usually solidity) questions.

5. I've been passively following DeFi since my startup collapsed, so that's probably the answer here.

6. I know my automoderator rules well.",2021-02-23
"Hello,

Happy to apply

1. Very experienced and was a mod for r/playrust for a year which has over 250,000 members on a previous account

2. Understand rules and how things should flow

3. Very active, australian AEST time so i can moderate at off peak hours for reddit

4. I feel the sub as a whole needs abit of a refresh and more life, which i could definitly kickstart.",2021-02-24
"1. Mod r/pga r/xDAI and several others. Experience in design, community building, strategic partnerships, modmail, and subreddit organic growth.  
2. PST. Daily
3. Crypto commentator + LinkedIn newsletter. YouTube 1000+ subs, LinkedIn 500+ subs
4. The go-to subreddit for Ethereum mainnet and Level 2 intelligent, well-informed discussion.
5. Level 2 solutions like Binance Smart Chain, xDAI, Matic, and all attempts to utilize Solidity in EVM solutions.
6. The potential for r/ETH to scale with strategic growth initiatives, to me, is readily apparent with a core mod team with an inspired long-term vision.",2021-02-24
"1. I moderate [r/ethdev](https://www.reddit.com/r/ethdev/), and formerly moderated a few subs for other companies in the crypto sphere.
2. GMT+1 office hours
3. I've been involved since 2016, and my focus has been smart contracts 
4. My moderation focus is usually anti-spam and answering technical (usually solidity) questions.
5. Looking deeply in l2 solutions and new defi projects, to build out more liquidation bots.  


Sorry u/dillon-nyc, seemed like we have much in common, so I took half of your things ¯\\\_(ツ)\_/¯",2021-02-24
"I'll apply to help out:

* I run /r/EthDev ( we've linked to /r/eth in our sidebar since forever, feel free to link back ).

* Got a good historical understanding of how crypto-communities in the past have derailed due to having the wrong people gathering too much power and the effects it had on projects ( having witnessed the /r/Bitcoin fork, as well as Ethereums TheDAO fork - from a front seat and how the subreddits played a great part of how the stories unfolded for better, or for worse ).

* I'd be happy to offer advice on how to prevent these hostile takeovers from happening, and how to uphold democratic values in subreddits which are heavily top-down oriented by nature. I believe the integrity of the communities to be especially important for decentralized society-changing technologies like Ethereum, and for this reason I'm known to be more strict toward moderators than toward users. 

* My philosophy has always been: preventing abuse by moderators and keeping communities the property of the public, as much as feasibly possible. Practically, you can (easily) maintain integrity by creating a climate where moderators have to respect the users more than the other way around.  I believe this to be key. The users are your guests, and the moderators should **help** them (not *rule* them). I can offer you advice on how to build and maintain such a healthy balance.


* Some key differences between the Ethereum-related subs that I am familiar with:

 At /r/EthDev we are open to recruiting new moderators all year round, and we have perhaps the biggest number of moderators in any crypto sub ( a total of 31 , for 35k users ) to ensure openness.

 /r/EthTrader wishes to keep the team small ( 6 people, for 1 million users ). That's another way of running a sub which I personally find risky in the sense you need to have more luck in having the ""right select few"". This *can* work with the right people onboard. But this can also fail with the wrong people. If you opt for such a strategy, /u/carlslarson might be happy to help you out for the selection process and giving you tips, he's a great person.

 /r/Ethereum is run mainly by a highly-thrustworthy team of people who've done a lot for the Ethereum technology ( 13 people, for 700k users) . Having one of them to join your moderation team always seems like a valuable choice imho.

* I can help on some technical stuff ( setting up automated spam filtering, similar to what we use )

* You can always contact me for help or advice, regardless of which vision you decide to apply for this subreddit.

I hope these extra bits can help you get an idea of how you could form the /r/eth subreddit.",2021-02-27
"Hey I’d be delight to help!

I believe we share a lot of similar values (for Web 3.0). As the founder of the 2018 ico livetree, we are now finally technically capable of building the vision of Web 3.0. Having recently learned Rust I’ll be discussing eth gas to the Polkadot ecosystem governance along with how it fits our Netflix video infrastructure tomorrow https://www.livetree.com/web3/
Perhaps we could talk then?",2021-03-22
"1. I have helped moderate /r/CryptoTechnology and /r/CryptoRecruiting since 2017. I'm good with css, managing submissions/comments, modmail, and pretty much everything with modding except for automod, but I am an experienced developer so I could figure that out pretty quickly I'm sure.

2. EST, I check reddit multiple times a day throughout the day, usually from 7am to 10 or 11pm.

3. I started mining BTC in 2012, I've held eth since 2016, I've done some side projects that integrate with eth, I'm running a staking node, I'm part of metagame, and I'm a /r/CryptoTechnology and /r/cryptorecruiting moderator.

4. I'm just trying to help keep misconceptions, FUD, and FOMO at bay. Help manage realities and expectations. I'm very long on eth, and don't want people to be scared off from crypto because of its volatility, or because they want a moon lambo. The actual real possibilities eth can solve, like decentralized banking, governance, DAOs, etc are the exciting parts. Moon lambos are also cool lol.

5. I follow Ethereum development, chain link, the graph, matic (now polygon), and metagame. I also follow sassel0x's videos/podcasts/twitter, I watch the dev streams occasionally too.

6. Long term, I'd like to help make something like Reddit combined with Patreon that has decentralized governance per subreddit, to financially incentivize good content, and disincentivize low effort posts and reposts.",2021-05-03
I cannot vouch for this guy... But he seems legit?,2021-02-24
"New floor or not, new high or not, if you believe in it’s value and have the expendable money then it is always good to buy. If it goes down, average down and smile. If it goes up, average up and smile.",2021-02-23
I bought more. But who am I? Just a boy with a dream,2021-02-23
Yes.  It looks good to me.,2021-02-24
That’s awesome!!!! Anyone know if I can add this form of payment to my Shopify?,2021-02-21
Is it ShopPay  that takes crypto?,2021-02-21
For all comment readers - 10% off any order using the code 'crypto' at check-out,2021-02-21
Noice,2021-02-21
"Yes you can. I am using Shopify as well.

&#x200B;

Add Third Party Coinbase and CoinPayments - give me a shout if you need help",2021-02-21
Shopify can integrate with Coinbase and with CoinPayments,2021-02-21
"i am thinking of buying stuff but cant figure it out,",2021-02-21
Gunna add this today. I’ll hit you up if I get stuck.,2021-03-07
OHHH< I see! Interesting!,2021-02-21
Where are you getting stuck?,2021-02-21
How did it go?,2021-03-11
You're welcome mate!,2021-02-21
I’m buying every dip,2021-02-21
[deleted],2021-02-21
"I have a stop on my ETH that will pull me out a fair bit before I make a loss. However, I expect a bumpy ride and will buy more in the dips.

I’m fairly confident that ETH will gain mass adoption and those of us holding will do nicely when it happens.

I’ve been tracking ETH against the rest of the market and it still looks pretty healthy.

Never counting chickens, though!

Moo the tune. 🚀🐮🎶",2021-02-21
"IIRC, the Berlin hard fork is currently scheduled for April 16 - I could see that shaking the confidence of Old Money in the crypto and encourage them to sell which could lead to a dip. Ideally, these are necessary growing pains which lead to stable/reduced fees in ETH 2.0 (including burning ETH, which could potentially drive the price significantly higher)",2021-02-21
"I haven't seen anything to suggest ADA will work with ETH. If anything ADA is set to supplant ETH in many instances. There are already alot of projects that have committed to jumping ship because of the fees. 


Hoskinson literally said just the other day that because of Ethereums inability to scale and upgrade combined with their high fees that this is why Cardano kicks Ethereums ass.


He also said that there is still a place for Ethereum as they work to get their fees under control. 


BTC and ETH also need to work hard at reducing their carbon footprint. The world will start to become anti both of them as they begin to understand how much energy and cost is associated with mining them.


I am a holder of all of them. Just telling it like it is.",2021-02-21
I'm trying to buy a little every month.,2021-02-21
Hope eth2 corrects this. Do you have ada? Cardano is supposed to have these issues corrected,2021-02-21
I'm betting on this too. Up to my knowledge eth2 will be under the same ticker eth correct?,2021-02-21
"EDIT: April 14 ETA for the hard fork, not April 16",2021-02-21
"From everything that I've read, that's correct - ETH now and in the 2.0 system will remain under the same ticker/no need for manual conversion of any type.",2021-02-21
"Many people minted coins and loaded them with ETH, BTC,LTC etc. in the past and even now as a collectible item.

Might be a good idea to post a picture of it so someone could help you more easily. If the coin came in an authentication case and you opened it make sure no details like private keys or anything are visible in the picture.",2021-02-16
"Basically eth and gas fees is what happened. Its too high and it cost you dearly, sorry",2021-02-13
Why did you exchange ETH for USDT instead of just selling on an exchange for USD?,2021-02-16
Holly fuck what's the fucking issue with that bullshit,2021-02-13
I sent usdt to another usdt...,2021-02-16
"It's fees, bigger the price, bigger the fees, same as bitcoin, it can't be sustained, may I recommend something else, like nano, ada, zil",2021-02-13
wow,2021-02-10
Something something.. too good to be true.. something something?,2021-02-11
"BTW, I just saw this notice in the community Telegram... if you installed yesterday, you have to update:  


⚠️⚠️ NOTICE ON LATEST INSTALLATIONS ⚠️⚠️

A bug introduced in the demo trading system Lightning Strike was causing backtests during the Welcome tutorial to not work. If you installed Superalgos within the last two days, you will likely run into this issue. The solution is to update now.

To update from within the app, open the Docs tab on the left hand side and type the following command in the search box:

app.update

Then close the browser and the client, restart, and resume the Welcome Tutorial. Let us know if you run into any issues.",2021-02-11
"Super noob question, but what benefit does this have?",2021-02-13
"Whats the learning curve on this like?  I've done some day trading previously when I had some time and didn't do badly, but my problem is I simply can't dedicate my life to do it, I'm also hesitant that I could easily fuck up and lose a load of money so don't want to leave my current employment for it.

Are there any low return examples that a newbie can initiate and just watch to see how it works and possibly at least cover costs?  Or is it a very much, here's the software, now learn a metric fuckton, and very good luck?",2021-02-17
That's what I said ;-) Wait until you do the tutorial... it's kind of mind blowing...,2021-02-11
"The skeptic approach is the right one in anything crypto / trading related. So, do your homework and decide for yourself... I just saw this article shared in the Community Telegram, which seems appropriate: [https://medium.com/coinmonks/crypto-trading-bots-how-to-avoid-scams-and-pick-the-best-one-feaf5be7b71](https://medium.com/coinmonks/crypto-trading-bots-how-to-avoid-scams-and-pick-the-best-one-feaf5be7b71)  


The author is part of the team, and seems to agree with you that you need to approach this kinds of stuff with care...",2021-02-11
I installed today and am up to date on patches but running into a (seemingly) continual loop on the tutorial of backtesting -- waiting for lightning strike to be run for \~hour?,2021-03-05
"If you know nothing about trading or trading automation, then you may learn a thing or two. If you find the space interesting, it's a great way to get started... Very deep rabbit hole... be warned ;-)",2021-02-13
"There is a learning curve, no doubt. But there are tutorials and a few strategies you may play with. There's also an active community to engage with... If you know about trading, then it's all about building a trading system, that is, describing the rules the govern your trading...",2021-02-19
I wish you nothing but good fortune! ;),2021-02-11
"You probably didn't run the Backtesting Session. After running the task, you must run the session...",2021-03-12
This is a rabbit hole indeed. I’ve always wondered how one could capitalize on the 24/7 crypto market-this is it!! Thank you kind stranger :),2021-02-13
Enjoy my friend!,2021-02-15
Join 2nd Mint Drop: [https://vtoken.io/drop](https://vtoken.io/drop),2021-02-09
"there's a great tutorial here

[https://www.youtube.com/watch?v=54buLNM45Rs&ab\_channel=PromoTeamChannel](https://www.youtube.com/watch?v=54buLNM45Rs&ab_channel=PromoTeamChannel)",2021-02-09
Why 2024?  What happens then?,2021-02-05
Eth 2.0 should be fully live by then,2021-02-05
It could be huge and I mean huge potential,2021-02-05
That’s what I’m hoping I’ve read stuff saying 20k over the next few years but I’ve seen some stuff saying 80-100k.,2021-02-05
I’m trying to buy up as much as I can. I’d like to have at least 5 shares before it goes crazy,2021-02-05
Edit: ETH just hit a new all-time high.,2021-02-02
it's 1500$ NOW!!!!!!! SO CRAZY,2021-02-02
Dip,2021-02-02
"We penetrated a double top, so it’s most likely that the range from 1400 to 1500 gets played for awhile before we move on toward the inevitable $2000. Lots of selling at and just under that to come.",2021-02-02
Can you see a dip coming,2021-02-02
"From looking at the charts you cant predict because so much goes into it. Charts just give you a good narration where your triangle breaks from a 4hr, 12hr,  24hr and 3day. It looks like all 3 have broken upwards I'm not exactly sure about 3 day but the target looks to be around 1800 but I don't think it will stop there. I believe it will extend to the 2 spot which is coming in at 1980 to 2025. Also do remember we have CME's coming the 8th. Last time when CMEs were introduced to bitcoin the price was around 14k and ran to 20k in a few day then down it went. I see a solid break up for 4 to 5 days but I would lean on the side of caution especially if the extension is hit around 1800 up to 2000. I could see a pull back to 1110, and then with coinbase ipo coming out in end of February first of March I could see another drive up. If it breaks 1110 I would look for a bounce at 960 then final bottom around 750 to 775.",2021-02-03
"Buy low sell high is always the goal. Right now it’s all time high, so...

Not financial advice, because I’m not qualified to give it.",2021-02-02
"Yes and no, but yes, but no

Just DCA baby",2021-02-02
..What dip?  I sold a bunch at 1543 to take some profit and have waited for a dip to buy back in ...... nothing.,2021-02-03
"It all depends on an asset. If you really wanna buy something now, get some CRBN as that one will only keep going up the closer the beta launch approaches, and if you aren't in a hurry, wait for a dip and get some ALBT as that one is a sure bet",2021-02-05
With bitcoin rallying and leaving Eth behind a bit eth should break up to 2000 then probably have a cool off before it reaches upward of 2500 if bitcoin stays in a range. We should be healthy uptrend for 3 to 5 days,2021-02-09
Theres a big wall at 2k if we break the sell wall look out. ETH could really run for .05 of a btc,2021-02-09
I would wait for the dip. It’s been a bit unnaturally crazy for 24h. I wouldn’t be surprised if it kicks down a bit in the next few hours... but I could be totally wrong too. Not financial advice etc. Don’t listen too much to what I say.,2021-02-02
"Double too? It looks like this was the 4th test of 1400, could be a solid breakout into price discovery, no?",2021-02-02
Thanks!,2021-02-02
Whats a good number to sell at?,2021-02-02
"Yes, what you say sounds right, but who knows",2021-02-02
I have no idea,2021-02-02
"There are no cards that are affordable.

i guese 6900xt would be possible. But they have a ROI of 7 Months ...",2021-02-02
