comment_body,date
"The main thing is to have something basic, in which the main amount of money is invested, which is very important to you",2021-05-07
"What gives you access to your wallet is a private key or a keystore+password without it you have nothing.
Check your emails to see any exchanges/wallets etc that you might have subscribed to. If you used an exchange you can indeed login with email and password.
Check your apps and browser extensions on your phone and computer. If you used metamask and still have it installed you can login with the password only.
Good luck.",2021-05-08
How many ETH wallets are there to search for? Feel like you would find it eventually considering you found it when you created it.,2021-05-08
"All I was written to it was ""Ether-Wallet""
I can remember that I were using ethereum Mist in the past, but not sure if I switched to another wallet. 
And when.... there is for sure no keystore. 
I was more into paper wallets",2021-05-08
Do you have your seed phrase?,2021-05-08
"When it was Mist wallet with keystore I am lost
Everything else I try",2021-05-08
Maybe try a usb wallet if you have one or a hdd one. And else just try coinbase and such exchange sites,2021-05-08
"Nope.
Just password and adress
The thing is, which I maybe just had mention before:
I was getting an Email by some dude telling me He knows about my wallet and my problem with access. To that point I had totally forgot about that wallet.
So Ive gone through my documents (papers) and found it. The amount he mention was correct. 
So I started to try recover it 
Without success
Him knowing my Email must mean whatever wallet it is, my Email Adress was part of it.
Data I have = eth adress and PW",2021-05-08
Already gone through all of them. Just coinbase is left where i recover my acc. For some reason it was disabled.,2021-05-08
"He is assuming I have no access anymore. 
He is right.
I didnt answer of course. It smells like scam.
But if I cant access, I have to try fool him to get some info. 
Before that. My last hope is coinbase",2021-05-08
"Sounds like you have the login details to some sort of account. Whatever that account is, it is not your wallet. Your seed phrase is your private key is your wallet.",2021-05-08
And nothing on usb sticks or any drive. Gone through all already,2021-05-08
"But i dont found any phrase or privat key
At least not for eth.
I will continue the search. But in the end i propably have to get into the shady offer.",2021-05-08
How about bitminter or any other mining software wallet?,2021-05-08
Never used mining software,2021-05-08
Are you me?,2021-05-07
"This is the dumb shit that's going to make me leave this sub.  


If your feelings are all caps about any of your investments you're doing it wrong. If you LOVE something only because it's at it's high then you're going to have a bad time eventually.",2021-05-07
"WHO SAID THAT?? I am a long investor... I am not a day trader... Ethereum is the future, and I believe in it!!... I am in AMC to save an American tradition: The iconic Theatre Experience...",2021-05-07
"SORRY - there are just lots of people who are buying on emotion. Sorry to be so judgey, if you're pumped that's great. There's just a lot of people who are running around screaming throwing their money at shit and it's a bit much lol.",2021-05-07
"Etherium is so diverse.... 

To give an analogy: Bitcoin is Gold and Ethereum is Oil.... Oil can be used for many more things than gold, hence can have much greater value... ;)",2021-05-12
In solidarity.... ;),2021-05-11
And still love ETH.... I am as LONG as they come...,2021-05-11
I already know that it will pass btc mark my words,2021-05-03
"$3,252 at the moment...  


Feels like when BTC broke the 3,500 mark and never looked back!",2021-05-03
Lol $3450,2021-05-03
Let’s take this to $5000 easy,2021-05-03
$3379 now...,2021-05-03
I feel so late to the game having just bought my first ETH three days ago. But I know in five to ten years I’m gonna be a happy man haha,2021-05-03
Wait til they see the price now,2021-05-03
$3442! You're livin' in the past maaaaaan,2021-05-03
"Yes I have one and I’m holding till it gets to $20k and beyond. Bought in at $2700. It’s only going to keep going up. If you don’t buy now, you will be mad at yourself when it hits $5k in a few",2021-05-04
Dollar cost average your way in.,2021-05-04
"Either way u look at it, if u buy and hold now, your going to do well in the long run.",2021-05-04
You can do 50-50% of both. ETH and BTC are the best coins for a long run,2021-05-05
"If you're planning on HODL'ing then I would say the best strategy is DCA. Don't shoot your whole load at once. Plan to invest steadily over a period of time.

Maybe $100 a weeks

Research shows time in the market beats timing the market.",2021-05-05
I thought the same thing like a week ago at 2700. Sure glad I didn’t wait,2021-05-05
"should buy, its a long-term investment",2021-05-04
It is,2021-05-04
"Loook at the eco system, how many developers participate in the side projects. ETH is good.",2021-05-05
YESSSS,2021-05-06
Decent buy at 3.2k? Or should I wait for a slightly greater dip?,2021-05-04
Agreed. I was terrified when I bought some a couple of months ago and yesterday's run gave me a lot of confidence that I made a good decision.,2021-05-04
Time in the market beats timing the market🚀,2021-05-04
*Ether way - ftfy,2021-05-05
"So if I invest 1,000 now it would not be as effective if I DCA every week (100 or more) ?",2021-05-05
"The floor is raising my man. If you didn't catch the dip last night then just wait for the next, but it's raising.",2021-05-05
Thats what research says. No one has a crystal ball though.,2021-05-05
Need to buy in before it hits $3k. Do you think we shall see a dip tonight?,2021-04-28
Was I right or what?!!!! ;),2021-05-05
Up and down.....,2021-04-28
"Two steps forward, one step back... Healthy...",2021-04-29
3k!,2021-05-02
🚀,2021-04-24
BET holders and players on [EarnBet](http://win.earnbet.io) have been increasing lately and I have been enjoying more ETH dividends every month and hodling those ETH now.,2021-04-24
Awwwww yissssssss,2021-04-22
"Yes, We Advice All Of Crypto Lovers To Buy Bitcoin Or ETH. It is the best time to buy Bitcoin, ETH, And All other Crypto

Buy BTC And ETH Here: [https://www.shiftal.com/register](https://www.shiftal.com/register)",2021-04-22
No issues here,2021-04-19
"good to know thank you! question for you, so i have never bought any ETH before, can i buy it directly with my debit card? Im thinking maybe thats my issue, as i have bought some types of alt coins before that required me to buy BNB transfer to smartchain then transfer into the currency i want. What is the process of buying ETH?",2021-04-19
"If you’re using binance, then you can’t buy eth yet, they’re down for maintenance right now.",2021-04-19
Where are you buying it?,2021-04-19
"trust wallet, but i have a browser extension so i can use other sites to buy and store in trust wallet",2021-04-19
"Metamask has a scam alert claiming they do not promote any forms of ""giveaways"" on Facebook. Any that you receive are scams.",2021-04-16
"never enter your seed phrase anywhere, it's always a scam. if someone has your seed phrase, they can take your crypto. 

the only use of having someone's seed phrase is to steal their crypto. there are no other possible uses.",2021-04-16
Scam,2021-04-17
"Basically they are saying that you have won an award but to receive it you must give them all your money and then they will give you back all your money plus the reward.

The typical money doubling scam first seen at the grand exchange in Varrock.",2021-04-17
Thank you kindly!,2021-04-16
My thoughts exactly!  Thanks!,2021-04-16
No believe it or not you're still early. I've had reoccurring buys through the highs and lows. Buy now buy every dip retire early,2021-04-16
250£ per coin? Im not the most bullish person but I honestly dont think we will see eth dipping below 1000$ ever. There might be a 10-30% correction coming up in the next months but it wont matter in the long term. Id suggest not trying to time the market but buying and holding for a couple years.,2021-04-16
.,2021-04-16
I think you should do it!,2021-04-19
"Sounds exciting 
. these comments have given me more confidence. I just feel like it would be going to waste in a savings account. So I’m going to go for the risk 😎",2021-04-16
"Just bought some more today, sitting on .38. Any PT on this short and long term?",2021-04-18
"I think OP means if their original investment of 500£ drops to 250 - basically if ETH's price drops 50%...

and if that happens Id say put in 500 more bc there is a lot being built with it.",2021-04-16
"Advice: keep as much as you’d need for a couple months of Needs in a savings account anyway, don’t mess with that. When it is all tied up in cryptocurrency, especially Ethereum right now, it can be hard to access quickly without losing a lot of it. The fees are prohibitive right now so whatever you put in Eth and ETH-based cryptos, you should plan to be able to just PARK that and not need to move it around. I have ~$150 in ETH I can’t seem to do anything with because I’ll lose half of it if I do anything with it besides leave it sitting there!",2021-04-18
I must have miss understood. Yeah id say buy now and if there is a 50% discount on eth buy more,2021-04-16
Thanks that has explained it a lot better 🙏,2021-04-16
My bad I could have explained it better! Thanks anyway .,2021-04-16
"I have been doing that, I was down a considerable amount for awhile but kept building my position and am glad I did. I’m thinking long term. I’m also thinking we are early on this lifecycle graph and maybe around the pivotal point highlighted in the following link as ETH and crypto is being embraced by govt, institutions, and the masses at this very moment:

1. Early Adopter Chasm: https://medium.com/@shivayogiks/what-is-technology-adoption-life-cycle-and-chasm-e07084e7991f 

2. Original Theory is [Diffusion of Innovations](https://en.m.wikipedia.org/wiki/Diffusion_of_innovations)",2021-04-16
"1) No. Ethereum is absolutely separate from the ERC20 economy, but I will say they tend to be linked in the short term. Generally speaking, almost every ERC20 token I can think of from five years ago when ERC20 was just kicking off is worth roughly zero (with a few exceptions, namely MKR).

1) (the second). This isn't the first time the block reward has been cut. It used to be 5Eth per block. Ethereum has whats called a ""network effect"" at this point, and that has nothing to do with the actual network. What that means is since so many projects are already on Ethereum, a new project is more likely to launch on Ethereum than any other comparable network. If something disastrous happens in the switchover to Eth2.0, I would expect most people would just stay on the Eth1.0 network.

2) BNB is a token, but what most people talk about in relation to BNB is the Binance Smart Chain, or BSC, which BNB interfaces with. the BSC is effectively a comparable version of the Ethereum network, and personally I use it as a ""high stakes testnet"" since I don't think malicious actors really do much on the testnets, but the memepool games and whatnot absolutely are happening on the BSC.

2a) I think ETH2.0 scaling will work. Once I didn't but the Eth2.0 testnets are exceptionally impressive.",2021-04-15
Buy! It’s cheap at the moment...,2021-04-15
"If you can hold few years ,then MUST buy!",2021-04-15
"First and foremost. ETH is NOT a store of value. 

It is a vehicle to pay transaction fees. Ethereum is a platform for decentralized apps and eth gives it power. 

This is important because that means increasing the cost of ETH has negative affects (cost to use dapps goes up).",2021-04-15
TRON surpassed eth in usd stable coins on its network..fees are way way cheaper. TRON is 16 cents so...do the math there on how much network success or performance drives price of main coin:,2021-04-15
Thanks so much for your reply! Very detailed. Sorry for screwing up the numbering lol. Fixed it for the future. But yeah everything you say makes sense.,2021-04-15
"But with proof of stake, all the computing power comes from ETH holders. If ETH is worth 0 then nobody will be incentivized to stake and this would still have detrimental effects on dapps no?",2021-04-15
What are your thoughts on the idea that any block chain will get higher transaction fees/sustainability issues as the network increases?,2021-04-16
"Even if eth is worth 0.00001 people will still be incentivized to stake. 

Actually a layer 2 solution MATIC/Polygon does this already for Ethereum and the APY is ~20.00%. The cost of the token is 0.43 and the gas fees are almost zero.

Imagine swapping tokens on uniswap almost for free.",2021-04-15
I’m not sure what you’re asking? With any network as it grows massively over night there will be sustainability issues and a token that shoots up. However a good system should self regulate and not bone the users for transaction fee gouging. The stability tends to sort itself out over time as more people join or if you’re in a newer system where you can introduce yourself through protocol or community vote.,2021-04-16
Can you explain how they would incentivized to stake and gain interest on something worth .00001?,2021-04-16
4k-9k this Christmas,2021-04-13
This article has aged well lol,2021-04-14
Not Christmas yet,2021-07-28
Buying that 2 ETH is the best decision you’ve made in your life so far 💎,2021-04-13
Late? You’re early! I think you answered your own question. If you trust it and like the technology then there’s your answer! Just keep researching and you’ll become even more confident in your investment,2021-04-13
Not late bro.. getting in on BTC at 2200 would be like a no brainer.. Party just getting started!!! 10k by Dec,2021-04-13
"I’ve been telling people about eth since 2017 and literally everyone in my classes would roll their eyes.. now ha.. look at the price


I think the value is super low compared to how came changing it could be. 

No FA",2021-04-13
"late man the fun 

has only just begun welcome to the fam friend.",2021-04-13
Never too late!,2021-04-13
"Rogers Bell Curve my friend. You missed the basement stages but we are still at the ground floor. What likely brought you here is exactly the reason I say this. We have hit a pivotal moment where business, govt, and retail are all accepting the technology and backing it with real resources and new use cases are popping up everyday. Certain ones are even maturing and proving their worth. To the moon! 🚀[Rogers Bell Curve](https://en.m.wikipedia.org/wiki/Technology_adoption_life_cycle#/media/File%3ADiffusionOfInnovation.png)",2021-04-14
$ETH 🚀 the fundamentals are there.,2021-04-09
I’m newbie in defi but their content on YouTube is really helpful,2021-04-10
I dunno what about using their wallet but it sounds great so I think I should try,2021-04-10
i can see back staking made peak stronger,2021-04-10
good job peakdefi team when okex listing??,2021-04-10
also there’s a rumour about NFT,2021-04-10
"pls keep us informed, wallet looks like a great option for beginners",2021-04-10
yes for you this wallet is a go,2021-04-10
I saw their vid about NFT,2021-04-10
They predicted the future,2021-04-10
+,2021-04-10
try I’m telling u that’s a go for u,2021-04-10
Back!? Maybe bsc?,2021-04-10
I saw the info that the team is working at this point,2021-04-10
What is the rumour dude!?,2021-04-10
Ok mate thank you,2021-04-10
Mind blowing everyone is making their own NFT lol,2021-04-10
"That’s why I’m wondering about their project! Their content is great, they educate well!",2021-04-10
yes u got it right,2021-04-10
oh NFT in September check their roadmap,2021-04-10
Yeah man I knew,2021-04-10
Sounds great! Why not now? NFT is gaining attention now,2021-04-10
NFT is everywhere,2021-04-10
i think we might see a nice run up to Coinbase’s IPO on the 14th.,2021-04-06
Glad I bought some before all the NFT craziness started,2021-04-06
I wouldn't put it past eth to have a week where the market cap doubles. To some it feels like it's already late in the game but I feel that kind of price movement is still possible for eth.,2021-04-06
lol I doubt a week but there's no reason to not expect a large steady climb over time,2021-04-06
Just come back here on July 2021 and you will know that this prices are a joke,2021-04-06
I think the failure of the show of force on the 1st has helped push the price up. I’d love it to be at or above 3k this month! I am expecting it to rise a lot at we approach the summer and we get 1559,2021-04-07
[deleted],2021-04-07
We might hit it in my dreams,2021-04-07
One week is around the same time as the Coinbase IPO so once that happens I think it will open up a lot more regular people to crypto and a lot of people will start buying eth.,2021-04-07
Once crypto companies start doing IPOs and even more traditional investors and regular people are exposed to crypto we’ll see crazy amounts of money put into crypto.,2021-04-07
"Good thinking, once that happens I think we'll hit $3k and go up even more from there.",2021-04-07
And the NFT market is going to get way bigger than it is right now. We haven't seen the peek of the craze and that will be very good for eth. How big do you think the NFT market could get?,2021-04-07
We'll still have periods in a run where some crazy price increases happen.,2021-04-07
3k too high or too low?,2021-04-06
In July We could be at $10k eth. A lot of people will be complaining that they didn't buy in at $3k at that point.,2021-04-07
"Mining can't stand in the way of PoS, staking is the future.",2021-04-07
Yeah the failure of the show of force showed that nothing can really stop eth. We’ll enter a new bull run way stronger than before.,2021-04-07
What,2021-04-07
"**hit it in my dreams, we might.** 

*-JollySno*

***



^(Commands: 'opt out', 'delete')",2021-04-07
If you don't buy in early you'll always be dreaming of what could have been.,2021-04-07
The crypto market cap could double once that happens.,2021-04-07
hope so 🙏🙏,2021-04-07
way too low,2021-04-06
"We're going to be way past $3k in July, eth is going to be going up a lot.",2021-04-07
I really hope so.,2021-04-07
"We're about to go on a massive bull run, you should buy back in soon.",2021-04-07
RemindMe! 3 months “what is current Eth price?”,2021-04-07
What do you think the price will be in July? How high do you think we'll get?,2021-04-07
"I will be messaging you in 3 months on [**2021-07-07 09:32:07 UTC**](http://www.wolframalpha.com/input/?i=2021-07-07%2009:32:07%20UTC%20To%20Local%20Time) to remind you of [**this link**](https://www.reddit.com/r/eth/comments/mlpl4l/when_do_you_think_well_hit_3k_i_think_we_could/gto4myj/?context=3)

[**1 OTHERS CLICKED THIS LINK**](https://www.reddit.com/message/compose/?to=RemindMeBot&subject=Reminder&message=%5Bhttps%3A%2F%2Fwww.reddit.com%2Fr%2Feth%2Fcomments%2Fmlpl4l%2Fwhen_do_you_think_well_hit_3k_i_think_we_could%2Fgto4myj%2F%5D%0A%0ARemindMe%21%202021-07-07%2009%3A32%3A07%20UTC) to send a PM to also be reminded and to reduce spam.

^(Parent commenter can ) [^(delete this message to hide from others.)](https://www.reddit.com/message/compose/?to=RemindMeBot&subject=Delete%20Comment&message=Delete%21%20mlpl4l)

*****

|[^(Info)](https://www.reddit.com/r/RemindMeBot/comments/e1bko7/remindmebot_info_v21/)|[^(Custom)](https://www.reddit.com/message/compose/?to=RemindMeBot&subject=Reminder&message=%5BLink%20or%20message%20inside%20square%20brackets%5D%0A%0ARemindMe%21%20Time%20period%20here)|[^(Your Reminders)](https://www.reddit.com/message/compose/?to=RemindMeBot&subject=List%20Of%20Reminders&message=MyReminders%21)|[^(Feedback)](https://www.reddit.com/message/compose/?to=Watchful1&subject=RemindMeBot%20Feedback)|
|-|-|-|-|",2021-04-07
"We're going to blow past $3k, the real reminder you should set is asking how much people lost by not buying in earlier.",2021-04-07
Lmaooooo,2021-05-10
My body is ready for $10k ETH,2021-04-02
"assuming that ETH were to hit 3k or even 4k at some point during April, should I be trading all of my BTC for ETH? And then when ETH starts going down again I buy BTC? Is that a good plan or not idk.",2021-04-02
You can ask this on /r/ethstaker,2021-04-05
"Look for Rocketpool, as soon as the platform launches, I think it will be quite relevant",2021-04-05
What a lot of questions about this right now,2021-04-05
"There are several platforms that allow you to move your validator to a platform node. I will try to find ""validator as a service"". I liked bloxstaking the most among these platforms. But see for yourself what suits you best",2021-04-05
Thank you. I didn't know there was such a sub,2021-04-05
"Thank you, I'll look into it.",2021-04-05
The platform is really promising. I'm waiting for the launch as well.,2021-04-05
"I didn't know there were such platforms, thanks for the information",2021-04-05
Interesting. I'll check it out.,2021-04-05
I'm guessing you meant to say PoS and it might be hard to get all 115 million eth to be staked. I'm curious to see what percentage of eth would be staked.,2021-04-02
"Well, you can research the information more accurately at /r/ethstaker. 

But for a quick tip rocketpool or bloxstaking. Both platforms are quite interesting",2021-03-29
Have you tried running and configuring the node yourself?,2021-03-29
Also on the lookout for safer platforms,2021-03-29
"I agree. In fact, there are more options. But I would choose between these",2021-03-29
"Still, I don't want to get into technical manipulations. But I'm still thinking about this option",2021-03-30
"In fact, not all platforms really have the non-custodial protocol as non-custodial. Bloxstaking does have a rather interesting design for interacting with keys that are stored as an encrypted copy",2021-03-30
There is an application that will make it easier to set up a node - strongblock. It might come in handy,2021-03-30
Thank you very much for that advice. I will have a look at these platforms,2021-03-30
"I have heard of multiple of these being used for NFTs which is the most popular?  


Also any good resources for Minting yourself?",2021-03-24
"great post that,   Fabian Vogelsteller is the creator of the erc 20 standard, now hes working on lukso, cant wait to see what he does next.

#",2021-03-24
Nicely written out. The most frequent question I get from new entrants to the space is the difference between ERC-721 and ERC-1155's.,2021-03-24
You can look at rocketpool.,2021-03-24
I don't even know what to recommend.,2021-03-24
There are so many platforms for this now...,2021-03-24
Look at /r/ethstaker,2021-03-24
"You could try using Bloxstaking, maybe that's what you're looking for to run a validator. But as far as I know they don't have a staking pool yet. There are really a lot of custodial platforms now, and non custodial staking is very hard to find",2021-03-24
Thanks,2021-03-24
"Okay, I'll take a look.",2021-03-25
"Oh, good. I'll give it a try.",2021-03-25
hmm... I think Equilibrium team was already doing great things in DeFi. They built qualified product to serve an underserved community. I really like the way they work.,2021-03-31
"If you can set up and run the validator yourself, it's better this way.

There is an easier way to run it. Bloxstaking allows you to run the validator. It is completely non-custodial.",2021-03-22
Run your validator and configure your node. The main thing is that the system requirements are suitable,2021-03-22
You can look it up on rocketpool. That might be the answer to your question.,2021-03-22
You need to look at /r/ethstaker,2021-03-22
Thanks for the tip. I'll give it a try.,2021-03-22
"Still, it's a more complicated option",2021-03-22
Thanks,2021-03-22
"Okay, I'll look into it now.",2021-03-22
Hard to say for certain. ETH does have a great Network built so I trust it for the long term. Ultra Sound Money. Not financial advice of course,2021-03-18
I'm interested!,2021-03-09
"In addition 
I’m trying to see how we can use smart contracts in real a world setting
If every smart contract is tied with a currency then we’re going to have so many currencies lol",2021-03-09
"Zerion+Matic 

🙂",2021-03-05
