comment_body,date
"Another ATH, and then another, and perhaps even another?!",2021-01-28
That’s awesome,2021-01-24
"If you don't mind me asking, how much does it cost to mint an NFT as of late?",2021-01-25
[Rarible](https://app.rarible.com/token/0x60f80121c31a0d46b5279700f9df786054aa5ee5:102386),2021-01-23
[OpenSea](https://opensea.io/assets/0x60f80121c31a0d46b5279700f9df786054aa5ee5/102386),2021-01-23
Thanks,2021-01-24
"This one was around 0.03 eth.

I’m not rich, so I’m hoping a sale of this one would cover the cost of minting more of my art",2021-01-25
ETH getting this ATH in time of bearish run by a lot of other alts is surprising,2021-01-20
It really is 2017 all over again,2021-01-11
"Ah, sounds legit 👍",2021-01-13
"I’m a total noob, but I’ve been actively learning. My take is that BTC has found mainstream adoption as a hedge against inflation and delivers on it. ETH offers a different narrative, one that has yet to be proven to the mainstream due to scaling issues. When ETH can deliver at massive scale, then the investment community and retail will FOMO in.",2021-01-10
"I've been interested in crypto for defi purposes,  I'm not a fan of government or the unfair advantages of unethical practices of large corporations.  I believe blockchain and smart contracts can disrupt.  I'm  not really bright enough to really understand the tech or code outside theory... that being said I invest in those I believe in,  those that excite me... more so in those who I think can make me some monies.",2021-01-13
That's brilliant news that people are actually wanting to know about the technology...I have to admit bit coin makes excellent gold but is very old and outdated tech... I think I could come up with better DAPPS than what is currently available and I am still learning but the technology should always be priority number 1 that's kind of why I stopped looking at BTC and investing in it...XMR is a coin which is still a bit hard to store for super noobs without being scammed and having you money stolen from cranky hot wallets and ETH needs time to progress...,2021-01-10
"For example: https://youtu.be/ZQmoLOB7580 

Chamath doesn’t care about Defi right now. And he is right. Consumers don’t care about technology, they care about convenience and utility. I hardly know of any projects on crypto that are consumer centric, with the exception of BAT/Brave.",2021-01-10
That is true we need better DAPPS that are easily to use to make the ETH econ better but there are some coins which I would rather happly see thrive in technology that being consumer friendly like XMR...as long as it is secure and can be purchased through lucrative ways without centralised exchanges it will probably still thrive and become a coin which only OG enthusiast can own as most hot wallets on xmr are scammy,2021-01-10
"Yes, it is truly minuscule, it is just one google. A drop in the ocean really.",2021-01-06
Go to show how early we all are.,2021-01-06
[deleted],2020-12-20
thanks man,2020-12-20
you can stake in pool (this is link from oficial eth page) [https://beaconcha.in/stakingServices](https://beaconcha.in/stakingServices),2020-12-01
"I stake with bitcoinsuisse.

Supersafe thing imo. No downtime punishment, etc.

Downside is that they take 15% of your rewards.",2020-12-01
Thank you! So I essentially loan out my ETH and pay a small fee and earn staking rewards? Are those secure?,2020-12-01
Thanks zum. What made you stake with them versus others?,2020-12-01
"Thats the only provider ive had a personal reputation. (Nicolai is a beast)

Plus, they are going to get a real swiss banking license.
They will offer loans of your staked ether.

I have really high hopes in eth. So if you expect, that this amount of eth could possibly your ticket to retierment, you could get a loan and buy some real estate for extra chashflow, for example. Do you have hope any other providers could do that for 20 years, constantly?",2020-12-01
I would love to hear more about it! Maybe I will take a look after I finish with the $CLIQ tokens of [Deficliq](https://Deficliq.com).,2020-11-26
"yes, you are screwed. there is no way to recover it. impossible.

using metamask without a hardware wallet is incredibly unsafe. it should never be done except with small amounts. just like you wouldn't walk around with $70k in your wallet.",2020-09-09
"why exactly, the wallet itself is password protected, is it possible to hack or access it remotely?",2020-09-10
They had/have the seed words for the wallet. Don't need a password then.,2020-09-10
"a virus can just keylog the password and send the encrypted MM wallet to the maker.

not sure how MM is designed, but no matter the design, the keys must be decrypted at some point, and a virus pretty much has access to everything you type and see, as well as all files on your computer. there's no way to secure any wallet that is on a device connected to the internet.

the only secure wallet is one on a device that has no internet card.

the risk of getting hacked is low though, so there's nothing wrong with using a hot wallet with small amounts.",2020-09-10
"hm, I so it also applies for electrum and other desktop wallets... But my desktop with these wallets is Ubuntu, does it make me a bit more safe than using Windows 10?",2020-09-10
"not really, programs have millions of lines of code. a virus is just one line. even if you only use popular open source software it's still not safe. even programmers you trust import millions of lines of code from dependencies that they never read or look at.

the only safe method is a laptop that you never connect to the internet. the best is if it has no internet card at all.",2020-09-11
"It seems that the most innovative projects are dapps lol. First ChainLINK and now this. I like the idea of it, seems like a goold alternative for people wanting to go to a casino but can't cause of lockdowns.",2020-08-28
Sounds interesting for dem Yamz,2020-08-12
🍠🍠,2020-08-12
"Really cool, will check it out :)",2020-08-13
"Despite the shortcomings am a DEX person. Makes me feel in charge of the fate of my funds and the only one responsible for them. Uniswap, Balancer, WhiteSwap all the way",2021-01-12
Very informative. Definitely will be using DeversiFi from now on. Thanks for sharing!,2021-02-06
$eth question - what happens to your $eth when it turns to 2.0 ? How does that work?,2020-08-20
Mate I've been asking this question for so long and I've never gotten an answer,2020-10-07
defi and pos feature caught my attention,2020-07-25
i follow thşs project for a time and i can say that good to keep for long term,2020-07-26
"Payaccept with the European trademark provides users with an intuitive layout, powerful and lightning-fast features, and maximum security of funds and stand ready to give you everything needed to access incredible Blockchain products.",2020-07-26
"Many projects have promised to offer applications that will enable us to use cryptocurrencies in daily life and facilitate adaptation, but have not been successful.  I hope PayAccept can do it",2020-07-26
"if it succeeds, there may be a revolution in crypto payment.",2020-07-26
It has a solid team working behind the Payaccept project.,2020-07-26
Payaccept vision comes across as a broad project.,2020-07-27
PayAccept can be a pioneer in crypto banking.,2020-07-23
They just signed a listing agreement with the Hotbit exchange!  They will have more listing news soon.,2020-07-24
" The PayAccept card will be a significant network brand debit and also credit card, by default allowing it to be approved at millions of places as well as payment terminals worldwide",2020-07-24
Credit card deals caught my attention,2020-07-24
"If I use PayAccept, can I send and receive NFT or digital artwork? Because I like to collect nft.  Hopefully this feature will be added if it's not there yet",2020-07-24
The Payaccept project contains many innovations.,2020-07-24
Payaccept can be a successful payment method if it can sign fast and important partnerships.,2020-07-24
"Personally id use Celsius network to earn almost 5% with your Bitcoin if you don't mind depositing with them. 

That's the risk to take depositing BTC to earn yield vs cold storage not earning yield.

I have some btc in cold storage and some with Celsius earning some compound yield.

To each their own or courae",2020-06-26
Certainly interesting to spread the risk. I LL look into it,2020-06-26
"Out of interest , how would you convert your BTC into wbtc?. 

On Curve you can do using the renBTC swap but you pay some fees and gas of course",2020-06-26
"WBTC puts my funds into a contract, rather than depositing - seems the lesser of two evils",2020-06-26
What would stop an unethical bank from taking all your deposit and close down?,2020-06-01
FDIC laws.,2020-06-01
what is an EWT wallet? where you got the address from you sending the funds to?,2020-05-25
[deleted],2020-05-25
Hey I'm the head mod here and will try to help you. Will shoot you a dm,2020-05-25
Sad...I always send a small amount 1st and then see if it reaches.,2020-05-26
So sad to hear. Plz always check with a small amount or even check all details again after fill information.,2020-05-28
"EWT (energy web token). I was sending ETH to an exchange. I accidentally sent it to an EWT address (one of the tokens the exchange offers) instead of an ETH address. 

This is my metamask address I sent the ETH out of: 

0x536F3408abe0c59b510C998658B65c32f3D0861c",2020-05-25
Yup 😩,2020-05-25
Thank you,2020-05-25
For sure,2020-05-26
And I don't think any developer could help you instead of the owner.,2020-05-28
"> I was sending ETH to an exchange. I accidentally sent it to an EWT address (one of the tokens the exchange offers) instead of an ETH address.

Damn, I am sorry to hear that. Unless you have the private key to that wallet, or know the person who owns it, you aren't getting that money back. 

You best bet is to bring it up with the exchange and see if they can help you.",2020-05-25
Yep contact exchange support and pray. Best of luck. Tech savvy/developer can't help you there.,2020-05-25
Thank you!,2020-05-25
Why?,2020-05-14
"Ok here's an example.

I hold MCO and the current price is $5 per MCO

I want to buy bitcoin because I believe the price will reach $10000 and the current price is $8000, but I also believe that the price of MCO will go up.

With the loan requiring 75% loan to value.

I deposit 2,134 MCO wich equals roughly $10,666 and I receive 1 bitcoin.

The MCO is still mines so any increase I still capitalize on any increase.

The loan is at 7% annual so that's equal to $46.67 for a 30 day loan. And then there is a loan match fee equal to 1% of the loan amount, in this case it will be  $80 because the loan was for 1 bitcoin at $8000.

That leaves total cost at $126.67

Bitcoin rises to $10,000 
Profit = 10,000-( borrowed amount 8000+ total cost 126.67)= $1873.33 

PLUS 
During loan MCO rises to $5.50 × 2134 = Total value is now  $11,737 vs $10,666 when opened the loan.

Result in total account gain of $1873.33 from bitcoin + equity increase of $1071 from MCO price increase
= $2944.33",2020-05-14
Good point,2020-05-14
Thanks,2020-05-14
Do you currently invest?,2020-05-14
Did you post on r/ethfinance too?,2020-03-20
"I have, I am trying to spread the word about our project.",2020-03-20
">The solidity contracts are verified, so you can view their source code at Etherscan.

Where are the main contract sources?",2019-11-27
"All source code (including the contract source code) will be on github.

Would you use the dApp that I described?",2019-11-27
[deleted],2019-05-28
"Wait, no repercussion for borrower being unable to repay? Why would anyone lend.",2019-05-21
I don't see any collateral requirement. What incentive does the borrower have to pay me back?,2019-05-22
This is the second sketchy post ive seen in here on 24 hours.,2019-05-21
"It's clearly described and exemplified at [https://www.DappRunner.com/EtherLoans.php](https://www.DappRunner.com/EtherLoans.php).

Some would lend to earn a high interest rate.",2019-05-22
"Thank you for your question.

That issue (collateral requirement) is clearly described and exemplified at https://www.DappRunner.com/EtherLoans.php.

Please experiment with the Ropsten Test Net version.",2019-05-22
"I still see no penalty for not repaying ETH borrowed.

Also, how does the contract know what the ETH USD price is?",2019-05-22
"  

When you Borrow ETH, you only need to deposit prepaid interest. The Lender must deposit the ETH that they are lending equity for.

This will make sense if you experiment with the Loan Simulator at the website, and do some test loans using the Ropsten Test Net.

The main-net contract uses the MakerDAO price feed, the Ropsten contract uses FiatContract.com for the price feed.",2019-05-22
"Its actually a Contract-for-Difference (CFD) as opposed to an ETH loan or borrow, in that no ETH is transferred from the lender to the borrower. CFDs have financing rates, like the swaps in BitMEX. 

Nothing wrong with that, but it's good to be clear about what the contract does.",2019-05-22
"The description on the website compares it to a '**Call Option**', which it is most similar to.

I thought ""Ether Loans"" was more catchy than  ""Ether Contract-for-Difference"".",2019-05-22
"OK, this is more complicated than I thought. The ETH Loan amount is adjusted--in ETH--if the ETH price rises, but not if it falls.  The interest rate is like an option premium, though unlike an option premium it is charged via a unit of time.  Given an option's 'time value' is maximized when the strike equals the current price, after the first movement the borrower will want to exit, because if the initial interest rate was acceptible, after the contract loses some of its optionality the interest rate--and thus implied option premium--will be too high. This is true whether the borrower is in or out of the money. There's a reason why such option contracts don't exist.",2019-05-22
"The borrower should not exit after the first movement for the same reason that an ETH holder should not exit after the first movement.

You can take either side of the deal (borrower or lender) at any interest rate that you choose, so if you feel one side of the deal is bad, then take the other side. 

Just for fun, I will probably accept any offer that you post.",2019-05-22
"If the interest rate is zero the borrower has a free option: he makes ETH if prices rise, pays no ETH if prices fall. Clearly that is not going to sustain a market, because the lender would be expecting to lose money, and rational people do not do that. Not only must it be non-zero, but it must capture the implied volatility of the ETH price.

As this option premium is paid out as an interest rate, it costs the same on day 1 as day 30. On day 1, the option is at-the-money and the time value of the option is at its maximum. After a short while, the ETH price will move and the option value will fall as ETH deviates from its initial price. Thus, if an option is priced just right, so that an interest expense covers the implied volatility (say, a 0.14% daily interest rate, or around 50% ann), the next day it will be too high because the option value will have decreased as the price (probably) moved.

If the option value is ""too high"" on day 1, it will always be too high, and there will be no buyers (borrowers in this market). If the option value is ""too low"" on day 1, there will be no sellers because they will statistically lose money, as selling an underpriced option will generate losses.",2019-05-22
[removed],2019-05-07
"Yeah, it’s really bullish of late",2019-05-07
"I would be more inclined to trust your DApp if you:

 1) included a link to source code (guthub?)

 2) include a short explanation of how it works.

 3) even though I eventually found the contract on [etherscan.io](https://etherscan.io), you should include a link (showing verified source code)...

my $0.02",2019-04-22
 It's called circus. All jesters have voice for other to laugh at. Craig should be charged or investigated for all bullshit he has done and be cleared or shut the fuck up for eternity.,2019-04-11
"Well, among other things, he is being sued by the estate of David Kleiman for all the marbles, and part of the discovery process might reveal some interesting bits about those two's relationship with Bitcoin and with each other.  And just to share, I have set this night as my trading day as I am check my earnings on this grand [asset](https://darbfinance.com/?=Crored) platform. I just love Darb because it has the cheapest exchange on the market and also offers a demo account for users who want to try it first. I think that cheap exchange means more profit and don’t want to lose this opportunity to earn. Going back, I think the crypto world is becoming a showbiz/drama world for the past few weeks.",2019-04-12
" I am getting rich with CryptoLux io! How about you? Join the movement now and generate a stable passive income at [www.cryptolux.io](http://www.cryptolux.io/)! • CryptoLux is the best earning-platform! Join the movement now and generate a stable passive income at [www.cryptolux.io](http://www.cryptolux.io/)! • I have generated a stable passive income with CryptoLux… And you should do it, too! Join the movement now and register at [www.cryptolux.io](http://www.cryptolux.io/)! • CryptoLux has the most advanced Artificial Intelligence Bot in the market! Join the movement now and generate a stable passive income at [www.cryptolux.io](http://www.cryptolux.io/)! • My automated income comes from CryptoLux. This is the most stable and lucrative earning-platform I have ever seen on the Internet! Join the movement now and generate a stable passive income at [https://www.cryptolux.io/?sponsor=mansur01740](https://www.cryptolux.io/?sponsor=mansur01740) ",2019-03-24
"[LogFile.info](https://LogFile.info) stores all data on the Ropsten blockchain. No data is stored off-chain.

Other solutions just store a hash on the blockchain, which they link to off-chain storage. That is NOT decentralized. If any of the data is off-chain, then the server admin can modify or delete the data.

No one can modify or delete the files that [Logfile.info](https://Logfile.info) stores on the blockchain.",2019-03-11
"Not trying to knock your project.... but questions:

Is the Ropsten testnet really decentralized? How many Ropsten nodes are there? (not rhetorical, I really don't know). If there aren't many nodes on Ropsten, then wouldn't it make more sense to store on the mainnet?",2019-04-17
"> [LogFile.info](https://logfile.info/) stores all data on the Ropsten blockchain. No data is stored off-chain. 

So your files are stored on a test-net version of Ethereum?",2019-03-19
[https://bounty.quarkchain.io/register.html?referral=fbqa4r](https://bounty.quarkchain.io/register.html?referral=fbqa4r),2018-12-19
Shut up spammer,2018-10-09
2 Days left. I'll be on this game. ,2018-07-30
Who knows? I mean lets just see what will really happen on that day. Its too early too say things.,2018-08-01
I want to know whats the update for this?,2018-08-03
"This crossed my path all those months ago and I was intrigued firstly by the unique-looking artwork and then by the fact this game will be played on the Ethereum network via smart contracts. Blockchain gaming was still a fairly new concept then, and much has happened since, but I am still very interested to see the final product.",2018-07-29
Going to be interesting to see how the network copes with a big launch...,2018-07-30
It looks exactly like the shitty “ether games” where you put in eth and hope others do too so you can “play” the game by waiting until enough other people put in eth that you break even and can withdraw. It’s just like crypto trading but instead trading meaningless items ,2018-07-30
“that the contract always has enough to buy items at market price”. Then says it’s not ponzi. What if everyone made a rocket to profit and dipped simultaneously. Does the dev team put in their own money to sustain the contract or can it truly be magical saying if you put in 0.05 eth we can promise you will get 0.05 eth or more back? Where does the magic money come from? The people who take the big fees and give up. They even defended themselves saying it’s not a ponzi in their article. Exactly what a Ponzi scheme would say. I guess it’s not a ponzi if u can say the investors who lose money are just the people who failed to win the game.,2018-07-30
I'm playing this right now and I can say its a big YES!\~,2018-08-04
