comment_body,date
Can anyone comment what will happen to the weth holders and if they will get the hard fork tokens if the ethereum are held on matic network instead of ethereum,2021-08-02
This is a bad idea. You'll more than likely end up buying back in at a bad point which then results in reducing your position. Don't sell your ETH. Stake that half instead of selling.,2021-08-01
"Hi, Ethereum gas fees are needed to carry out any transaction on the ETHEREUM blockchain as they ensure your transactions goes through.  
The gas fees are subject to how busy the network is, like you did mention, it varies as seen in the price you noticed when trying to mint that nft.

For OpenSea, you can buy, sell and mint NFT artworks on that protocol. If just starting on Ethereum, I suggest you take time to visit [ethereum.org](https://ethereum.org)  to get better understanding of the chain as it got well-resourced materials for everyone to learn about the chain.

NB: every chain got its gas fee and this is what is paid to the miners (those that verifies the transactions) for every transaction, i.e from providing liquidity, minting tokens and buying tokens from launchpads and even in defi😋.",2021-07-25
"
Pretty sure EOSIO is way better.  EOSIO is a highly performant open-source blockchain platform, built to support safe, compliant, and predictable digital infrastructures. It supports public networks such as EOS, Telos, and WAX, and private networks alike. EOSIO is fast, flexible, and forward-driven, enabling developers, entrepreneurs, co-creators, and institutions to build and innovate with confidence",2021-07-25
"$COCKTAIL HOURS:  
  
Gearing up for an action packed + celebrity backed launch! :cocktail::tada::champagne:  
  
BNB + BUSD automatic hourly reward payments  
automatic + manual whale buy back bot system  
first ever rewards multiplier on the u/BinanceChain   
  
\#BNB #BUSD #rewards #HODL #Crypto #CryptoNews",2021-07-29
"Ok thanks, yes did understand all that about ethereum network and mining 

So was wnadering what your experience is with gas fees with buying nfts

Iam looking at getting some nfts at floor price and hodling till some hype if possible

What range amni looking with the gas fee 

Ive seen $4.26 was the cheapest i have seen for a week 

Any thoughts",2021-07-26
"$4.26 for minting is good bargin, with the huge gas fee in the market, I have experienced a  $150 gas fee charge for NFT, which I had to let go, because I had no such money, and this is one of the reasons why L2 NFT projects are booming.",2021-07-29
"Haha i sore 1300 i was so shocked 

Today i was looking at opening more packs but, the gas fee is 12 dollars, so i was out of eth, and took to long to send some over, you cant excatly send small bits over either 

One idea iam thinking each week getting paid from work, buy eth swap into Pmon, and store that up so i can make one big transaction, as i learnt today doesnt matter how big the transaction is itll always cost the same, plus if the prive of PMON keeps going up may be able to do other things 

As they said on there website 1 pmon eqauls a booster pack, now 1 pmon equaled 48 dollars at there launch as to now its dropped nicely 

Is that ""layer 2"" does that have a crypto name eth 2 or soemthing 

What projects are booming on that can you name a few ? 

Iam guessing they can hold more transactions and fees are lower",2021-07-29
"L2 means Layer 2 infrastructure, like xDai, Matic and the rest.

your idea of DCA into PMON is good, honestly, It's good to hold these value tokens but I'm kinda into the yield farming aspect of the market and hence interested in how to make profits from my NFT tokens, but I have found a solution with FORM",2021-07-29
"Yes i have bought into poly matic and thats layer 2 eth ? 

All the same blockchain gamed can be on that to, regarding transactions gas fees etc, 

Still getting the terms but what is DCA = and FORM",2021-07-30
"Matic (polygon) is a layer 2 solution for Ethereum, that good as you can find some blockchain games on this blockchain, even BSC got some blockchain games too.

DCA means Daily Cost Averaging, its a term that suggest individuals buying into an asset over a period of time as this will ensure your average cost will be reduced.

While FORM is the native token for [Formationfi](https://formation.fi) , a smart yield farming protocol that incorporated different pools and ensures its holders are given the best returns as the protocol takes note of those high performing pools in the crypto-verse.",2021-07-30
"O i should kow DCA haha, i have eth and btc coming out each week on an auto buy 

I will have a look at Form sounds interesting",2021-07-30
"weekly buy-in is awesome, Great to have your thoughts on FORM after your deep look at the protocol.",2021-07-31
I tracked the multi million $ scam network behind all the rug pulls and a good portion of the fake tokens right now without having the slightest computer forensics knowledge or blockchain experience. Does that count,2021-07-06
We’d love to hear the story of it. Post it on r/tradehelp,2021-07-06
Any news on your findings?,2021-07-29
"I’ve read it will use 99% less energy than BTC. And after Elon Musks bullshit I wouldn’t be supersized if ETH2.0 surpasses BTC in the future 😂. Read that slowly I’m not saying it’ll go to 60/100k. But I see BTC losing value to let’s say 20-35k, and ETH being around the same down the road",2021-06-30
"I believe Eth will be that new age internet as suppose, and it'll rise above all imaginations... Also for solid coins like UBXT that are built under its Blockchains, and have a use case of providing an all-in-one ecosystem for modern traders, will also perform well as it takes over the Trading space.",2021-06-30
stacking? you mean staking?,2021-06-28
"Rocket Pool is scheduled for release in Q2 of 2021, so it should release by the end of this month if it is to keep that schedule but it could possibly be delayed. And btw it's called staking not stacking.",2021-06-28
"Coinbase also released staking too with approx 5% APR, meaning they keep about 1.4% if you staked it yourself and ran your own validator.  The plus side is you can stake any amount but note you can’t touch the ETH2 until the transition to ETH2 is complete.",2021-06-30
Yes,2021-06-28
Thanks ! And thanks for the stacking-staking correction,2021-06-28
But coinbase offers a custodial service if I'm correct?,2021-06-30
I've already bought!,2021-06-22
🔥😊🥰,2021-06-22
Didn't know about such a project,2021-06-22
SCAM,2021-07-19
Wow nice to know about $TITS,2021-06-21
If this is on the bnb binance chain shouldn’t it not be on the eth ethererium Reddit,2021-06-21
Great project💕,2021-06-21
"Just gunna note, this post has been spammed into like 10 different subbreddits and was most just a copy/paste",2021-06-21
Believe in this project. My respect to the team!,2021-06-21
i report these all the time. Youtube doesnt care. They won a lawsuit recently around being sued for this kind of scamming. They deny responsibility as it is the people who make the content. They are simply the host. Sad really.,2021-06-19
"show us a link , bring attention to it to get it deleted maybe",2021-06-19
Yea they should at least read reports and do some reactive administrating.,2021-06-20
"It's always the top result when I put Ethereum in the search bar:

https://www.youtube.com/channel/UCsAZXdhFW6A9kINuk5G4SuQ/featured

There's also a duplicate
https://www.youtube.com/channel/UCect_zElY00rV_RIwD4hqxg",2021-06-19
"one is just a loop of car driving around other is interview with a pig picture

&#x200B;

strange?",2021-06-20
"Weird, maybe it's too trick the reviews if they get reported too often? I'm sure they'll run the Vitalik interview with the link and fake tweet again at some point. The stream titles are still the same as when they were running the scam video.",2021-06-20
Agreed. I think it’s so YouTube won’t see them doing wrong. I’m sure they can rewind though? Even if live. I reported them.,2021-06-20
"I've moved all of my crypto to cold storage, so it's gotten more difficult for me to compulsively check how my portfolio is doing every 15 seconds.

Which one lets me type in how much I own and monitor the value, without actually having my crypto on that platform?

Edit: I managed to do this on Blockfolio, if anyone else wants to do the same.",2021-06-17
Nice to know that!,2021-06-21
"It seems to me that any platform for betting is more convenient and promising than independent betting.   
Although still, in any case, there will be people who will be more interested in self-staking",2021-06-10
"There is not much information about eth 2.0 yet. Most likely, the launch will be at the end of next year, if not later",2021-06-10
"In fact, platforms like Blox are quite active in promoting the entire ecosystem.   
I also heard that after the launch of RP, there will be quite a lot of changes and innovations. We'll wait for now",2021-06-10
Thanks for sharing! I learned more about the project,2021-06-01
I'm down 30% on my investment. Waiting for it to go back up. Luckily I'm not losing my shirt.,2021-05-25
Can’t say which is better. It’s up to you to make that decision. But Coinbureau’s video helps you understand both coins better: https://youtu.be/SXfXydnXNH4,2021-05-22
"Let me ask you, where can I purchase a decentralized stablecoin on Cardano, and then where can I put that into a Cardano contract to get some yield?",2021-05-22
"Wish I could answer that for u, but I can’t. Would like to know as well.",2021-05-22
They'll likely both appreciate with time,2021-05-22
More stuff is built on Eth and Vit is super smart.,2021-05-22
It's currently got a much better ecosystem is the main reason people say it's better,2021-05-22
No its not better they are both shitcoins and you can make money so go for it,2021-05-22
it’s speculation @ this point.,2021-05-22
Buy algo. Earn while you wait,2021-05-22
This helped a ton. Thank you.,2021-05-22
Right now I see AgeUSD (as of about a month ago). But I don’t see yield yet.,2021-05-22
Ethereum a shitcoin😂😂 that’s hilarious,2021-05-22
Algo?,2021-05-22
"It's a trick question. They don't exist because Cardano doesn't have smart contracts, so you literally can't get yield on anything because none of it exists. It took Ethereum 6 years to get to where it is and its had smart contracts the entire time.",2021-05-22
Yes its a shitcoin and I have been holding since its 80 dollars yes I will make money from it and increase my BTC stake. But go ahead and love your shitcoins. At the end its only BTC that matters but make money while you can,2021-05-22
Ahh... interesting. Shows you how much of a noob I am. ;),2021-05-22
"The problem with Cardano is that it's all promises and always has been. I'm not saying they'll never have smart contracts, but even once they do release them, it's just getting started. You need thousands of developers building these systems for years before you see any sort of ecosystem form around them. So will Cardano be succesful? Way too early to tell. And honestly, the risk adjusted returns right now makes it not worth it imo. Cardano is worth 1/5th of Ethereum. So the most you could hope for is a 5x on Cardano if it succeeds in taking market dominance from Ethereum, and I think the odds of that happening are much smaller than 1/5. Probably something like 1/50 to 1/100 for the real risk adjusted returns. If Cardano was worth a few hundred million in mcap, then it would probably be a different calculus (albeit still a very risky one, considering I think Cardano basically has zero shot in my mind)",2021-05-22
Interesting. It kinda reminds me of the apple App Store (started it all and got established and set the bar) compared to Microsoft App Store (all promises and still lagging behind),2021-05-22
[deleted],2021-05-22
That is an interesting analogy that I like but maybe I have some bias toward apple.....oh and ETH,2021-05-22
"It's more like early days internet - Like when everyone was JUST getting online there were ALL these promising internet service providers and websites. Many, many, MANY, failed. Crypto CAN be useful. Like anything else, it's a tool. How well it's implemented and built out will determine how valuable it becomes.  


So a smart person would focus in on each one. When you have the extra cash, and you really understand something, THEN invest your money. Know what you're buying and understand who else is propping up the system.  


Most of our lives are smoke and mirrors but that doesn't mean it's not meaningful or based on something. Just study the history of these things and what they've done so far, keep a big picture perspective if you're invest for the long haul.",2021-05-22
And? Ethereum already has smart contracts,2021-05-22
[deleted],2021-05-22
I've been in crypto since 2013 and involved with Ethereum since 2016. I know who Charles is and what Cardano is.,2021-05-23
"Very nice 👍 

I was watching VersoView! It's good that the company promotes itself and others!
 

Can VVT be used as a payment method?",2021-05-25
VVT is a worthy currency!,2021-06-01
Possible if the website is integrated with DePay,2021-05-25
I like it 😌,2021-05-31
"No, I don't see that happening. I'd be surprised to see Eth below $1300-$1400 and BTC below $20k. I've been holding and trading since 2017, but that in no way makes me an expert. This just a prediction based off of the info I can gather and historical charts, not financial advice.",2021-05-23
"Just hit 1748 today , wonder how much lower it’ll get",2021-05-23
I hope it keeps going down until payday I'm not going to lie.,2021-05-23
Did not know about such a project and a coin. I see that soon everyone will know about the project!,2021-06-01
Did not know about such a project ... can I link the site?,2021-06-01
$VVT coming strong 🚀🔥,2021-06-01
"Whoever says they know is lying. But just like any volaitility, this doesn’t change the long term potential significantly. I wouldn’t be surprised if momentum takes it back up by the end of the year.",2021-05-19
[deleted],2021-05-18
Privacy,2021-05-18
"sounds cool, i'd love to loan out some of the Meebits i bought when it's live. joined discord",2021-05-16
Sounds super interesting! Joined the discord as well to see updates!,2021-05-16
Actually very happy to have such good investment opportunities right now,2021-05-17
"I see a very good investment opportunity, thank you",2021-05-17
"Interesting, actually.",2021-05-17
Thank you for such a promising project,2021-05-17
Thank you for such great advice.,2021-05-17
Thanks for the link,2021-05-17
It's a really interesting opportunity,2021-05-17
Already invested.,2021-05-17
Thank you for such a cool project,2021-05-17
That's a fresh enough idea.,2021-05-17
Seems promising.,2021-05-17
I'm going to see what this project is all about.,2021-05-17
"This is something new, an interesting project.",2021-05-17
"Actually very interesting NFT token technology.   
I wonder if there are some projects that allow you to farm NFT tokens or use this technology in farming",2021-05-17
[removed],2021-05-17
"BSC is needed for autofarming platforms, if that's what you mean.",2021-05-17
NFT tokens need mining,2021-05-17
"In fact, BSC is just perfect for optimizing profitability. Pumpy.farm is a really interesting prospective platform.   
I do think this is a platform worth trying, just to understand how the yield aggregator system works",2021-05-17
"Just carrections i guess, It is needed for the market so don't worry too much",2021-05-13
Or buy more 😂😂,2021-05-13
"Just HODL , it’ll recover",2021-05-13
It’s going back up,2021-05-13
"No, one company and one guy speculating doesn't change the entire market like this.  Most of the whales that control the price don't care what he does, they aren't like internet fanboys that make financial decisions based on tweets and late night stoner comedy",2021-05-16
"All from Ellen Musk, this is not normal correction.",2021-05-13
Hodler here... buy more.,2021-05-13
"I think you need to decide what your goal is. Are you interested in the technology and want to use things or take part in the ecosystem. Or are you looking save monthly. Or are you looking to try and maximise. (With a large risk appetite) 

All of these have very different answers and I'm sure there's other cases I haven't included above. 

Recommendations suffer from confirmation bias and people will largely assume your motivations are the same as theirs. Asking if you should buy ETH in an ETH forum won't give you any surprising answers. Work out what your goal or motivation is then ask if this will help achieve it.",2021-05-16
"I believe in ETH 100%. I started small and took profit  on other stocks,to buy 1 ETH at $2600. I have put in little more here and there. 
So maybe use your $13 and buy some small time Crypto on BitMart or something like that.
And watch it grow , and take profit from that to start buying ETH. You still have time.

$$Not Financial advice / I’m just swimming pool equipment , building and sales etc.. guy.

Good luck!",2021-05-16
In my honest opinion... 100% Ethereum.... Best BANG for the dollar.... Forget any side shoots or Binance....,2021-05-17
Crypto has become a joke really. Loathe it,2021-05-13
"Yesterday, we were right in saying that prospects of coins-memes remained unclear ...  
It was better to avoid experiments with ‘short’ positions as we can see that today 'dogcoins' have gained their positions back – DOGE +24%, SHIB +12%, AKITA +56%",2021-05-14
"You're 15 with the luxury to invest 1k dollars, you're doing better than 90% of the world.",2021-05-12
Tweet that to Elon,2021-05-12
First time?,2021-05-12
"imho, 
do not show how much money you have. 
Don't buy memecoins
DCA
Do not panic sell
Invest only in coins that have a future
You'll recover... be patient",2021-05-12
Ethereum is the future,2021-05-12
"We unfortunately can't predict what's gonna happen but eth will most likely be back in a few days I'd say

Also, please don't show your account balance online",2021-05-12
You’ll be fine big man!,2021-05-12
"First rule in crypto trading is only invest what you can afford to lose. 

I bought eth at 800 in 2018. Took 4years for it to correct. 
I sold other coins because everything I bought crashed hard. 
Lost a bunch.
My eth after 4 years are positive.",2021-05-12
"Hey. Here to help. You broke every rule of investing, but you'll recover! First u invested more than u could afford to lose. Next you didnt do ur research. If u did, you would know that etc and doge are bad investments. Btc will def go back up, this drop is nothing for btc. Ur other coins might go back up but there's no reason they should because they're shit. I made mistakes to early on but i recovered by moving my bad investments into good ones and leaving it there! Time in the market beats timing in the market. The easiest way to fuck up crypto is to trade ur coins based on gut feelings the way u are. Hope this helps! Dm me if u want more non financial advice i will never ask u for anything",2021-05-12
"If you really did invest over the past 3 months, then just relax, this isn't the crash, just a quick Elon Musk driven opportunity that gave people a short window to buy ETH at sub $3,700. A crash looks way uglier. September 2001 recent IPO tech company ugly.",2021-05-12
You are 100% fine,2021-05-12
"Sounds wack, but true: Just buy what you love and/or believe in and wait... most often that alone returns",2021-05-12
Need to relax mate. So did i invested in ETH ETC BTC ADA DOGE its the whole market not seeing the growth yet.. the whole scenario is changing in Late June. Hold on til then..!!,2021-05-12
Play the game for more than you can afford to lose then you will learn the game.,2021-05-13
It will rise again,2021-05-13
"There’s no regulation, so maybe not an age limit, however the age to form contracts is 18.",2021-05-13
"I invested the money in Crypto, that I won’t need in the next (at least) 5 years. 
There is not short cut.
None should expect to be loaded in weeks time.",2021-05-14
Great perspective. Also not to be a buzz kill or KJ. Do you know if there is an age limit for this?,2021-05-12
HODL.,2021-05-12
For what?,2021-05-12
"Yup, I'm personally doing that too",2021-05-12
To use the exchange? Thought it was for 18 or 21+,2021-05-12
some friends at school told me that you can trade crypto under the age of 18 and i did not believe it but they all looked at me like i was a dumbass so i think you can lol,2021-05-12
Most exchanges mandate a minimum age of 18. Check your own out.,2021-05-12
"I believe  it will happen, bitcoin right now is ahead of eth but eth is going up at a faster rate than btc. The potential of it catching up and passing it is pretty good in my opinion.",2021-05-14
"The great flippening 

https://www.buybitcoinworldwide.com/flippening/",2021-05-14
Bitcoin is only a store of value. It's like buying gold and letting it gain value. Ethereum has alot of everyday use. Crypto is just now in the first inning.. Ethereum is on deck. It's time will come. Or another coin thats better will take its place. But it's coming when crypto starts getting alot more everyday use,2021-05-14
"Yes it’s absolutely possible and personally I believe it will end up like that - though I wouldn’t like to guess when!

Bitcoin’s value offering as a technology is now widely known and fairly established. It’s room for growth as a platform is somewhat dependent upon adoption by major players now - a country using it as its primary currency or a few major banks adopting it will offer a chance for it to keep going. But in terms of innovation there isn’t going to be anything new to see from Bitcoin itself. Inversely, its huge price might be a bubble that’s set to burst at some point and even if not it’s vulnerable to big swings from all manner of influences. Criticism over its poor green credentials may have an unknown impact yet too.

Comparatively, Ethereum has a far wider value offering because it offers more than just the currency (Ether) using its blockchain. There’s a huge amount to be released in coming months and years that I think will make it the centre of innovation in the field and the focus of attention, while BTC has little to compare beyond novelty. As ETH moves to PoS it will also improve its green credentials and become the environmentally-conscious person’s choice - probably a major factor for businesses in the coming years when choosing who to work with on new projects. 

Ultimately, BTC has nothing to offer but an inflated coin that is first and famous. ETH has a whole platform to offer and will become increasingly resilient the more projects rely on it.",2021-05-14
We are half way there,2021-05-15
How is that possible when out a cap to the amount of coins that can be mined?,2021-05-14
"Yes, and I believe that it will come very soon",2021-05-15
"Seeing all of the negative headlines in the news lately  surrounding Bitcoin was making me concerned for the overall future of crypto. 

I get that Ethereum has a lot of advantages compared to Bitcoin, but I wonder if it will ever be possible for it to be the ""S&P 500,"" so-to-speak, for crypto.

Thanks for your optimism.",2021-05-14
I also recommend [ratio gang](https://ratiogang.com/),2021-05-15
"According to Vitalik they are positioning to be the web revolution after 5G

(Tim Ferris Show - Ep. #504)",2021-05-14
"**half way there, we are.** 

*-LoftySJ*

***



^(Commands: 'opt out', 'delete')",2021-05-15
There is alot of fud but look how fast eth recovered from those massive dips. It was pretty impressive.,2021-05-14
Sounds good to me! 👍,2021-05-14
Good bot,2021-05-15
"**my day, this made.** 

 *-IamYodaBot*",2021-05-15
"Thank you, LoftySJ, for voting on IamYodaBot.

This bot wants to find the best and worst bots on Reddit. [You can view results here](https://botrank.pastimes.eu/).

***

^(Even if I don't reply to your comment, I'm still listening for votes. Check the webpage to see if your vote registered!)",2021-05-15
They say don’t put all your eggs in one basket,2021-05-13
The great flippening. Yea dude convert all of your BTC to eth. And tell all your friends to do that too cuz I want my little eth babies to grow up big and strong,2021-05-14
I did but i think youre probably right.,2021-05-13
"This will be great. Staking reward will go from 35-250 %

Great place to stake my UDO and COOK",2021-05-07
Just recently saw news about cohort 4. How quickly time flies.,2021-05-07
"Cool, thanks for the news.",2021-05-07
All of these technologies I think are very promising,2021-05-07
Thanks for the heads-up.,2021-05-07
"In fact, I think this year is simply a breakthrough year for cryptocurrency. There are so many cool projects coming up",2021-05-07
"Okay, thank you.",2021-05-07
Has long postponed his farm on Unifarm,2021-05-07
Really very important event,2021-05-07
"Launch on the BSC, wonderful",2021-05-07
That's cool. Such projects are really promoting the entire industry.,2021-05-07
"Great, the main thing is not to miss this moment",2021-05-07
"I have seen a lot of interesting Defi projects, but I consider this most promising",2021-05-07
It's just a great time for the development of cryptocurrency,2021-05-07
Very interesting project and convenient features,2021-05-07
"Yes, that's for sure. But in this way it becomes more and more difficult to find interesting projects. A lot of Skam, as I think",2021-05-07
I've been able to find quite a few promising projects at the moment. But still not sure about all of them.,2021-05-07
"True. Out of all the numbers, I could only highlight the Polars platform that I'm going to invest in right now",2021-05-07
